{
  "principal": "developer-ai/rust-demo",
  "role": "developer",
  "change_id": "CHG-RUST-BROKER-001",
  "change_plan": "examples/rust-tool-broker/change-plan.json",
  "catalog_trust_policy": "examples/tool-broker/catalog-trust-policy.json",
  "catalog_signature_bundle": "examples/tool-broker/catalog-signatures.json",
  "workspace": "/tmp/oryvael-rust-tool-workspace",
  "tool": "rust",
  "action": "check",
  "audit_log": "/tmp/oryvael-rust-dev-control/audit.jsonl",
  "artifact_store": "/tmp/oryvael-rust-dev-control/artifacts"
}
